nome,ticker,setor,segAtuacao,descricao,P/L,ROE,preco_atual,debtToEquity,dividendYield,freeCashflow,ebitdaMargins,Beta,Liqui Corrente,Vol Med Diário,Margem Operacional,Máxima 52 Semanas,Mínima 52 Semanas,noticias
Itaú Unibanco Holding S.A.,ITUB4,Financial Services,Banks - Regional,"Itaú Unibanco Holding S.A. provides various financial products and services to personal and corporate customers in Brazil and internationally. It operates through three segments: Retail Business, Wholesale Business and Activities with the Market + Corporation. The company offers current accounts; funds management; payments and collections; loans; credit and debit cards; investment and commercial banking services; real estate lending and financing services; economic, financial and brokerage advisory; and leasing and foreign exchange services. The company also provides non-life insurance products covering loss, damage, or liability for objects or people, as well as life insurance products covering death and personal accidents. It serves retail customers, account and non-account holders, individuals and legal entities, high income clients, microenterprises, and small companies, as well as middle-market companies and high net worth institutional clients. The company was formerly known as Itaú Unibanco Banco Múltiplo S.A. and changed its name to Itaú Unibanco Holding S.A. in April 2009. The company was incorporated in 1924 and is headquartered in São Paulo, Brazil. Itaú Unibanco Holding S.A. is a subsidiary of IUPAR - Itaú Unibanco Participações S.A.",10.299252,0.21014,41.3,N/A,1.31,N/A,0.0,0.215,N/A,29765394,0.37305,49.67,29.650484,"[{'source': {'id': None, 'name': 'Abril.com.br'}, 'author': 'Leticia Yamakami', 'title': 'Ibovespa sobe mais de 1% com possível cessar-fogo no Oriente Médio', 'description': 'Investidores operam com maior apetite ao risco após declarações da Casa Branca sobre fim de guerra e novas pesquisas eleitorais no Brasil', 'url': 'https://veja.abril.com.br/economia/ibovespa-sobe-mais-de-1-com-possivel-cessar-fogo-no-oriente-medio/', 'urlToImage': 'https://veja.abril.com.br/wp-content/uploads/2023/06/GettyImages-1229674447.jpg.jpg?quality=70&strip=info&resize=1080,565&crop=1', 'publishedAt': '2026-03-25T21:59:52Z', 'content': 'Pular para o conteúdo\r\nASSINE VEJA NEGÓCIOSO Ibovespa, principal índice da B3 (Bolsa de Valores de São Paulo).\xa0(Cris Faga/Getty Images)\r\nContinua após publicidade\r\nO Ibovespa teve valorização de 1,60… [+1965 chars]'}, {'source': {'id': 'info-money', 'name': 'InfoMoney'}, 'author': 'Reuters', 'title': 'Ibovespa sobe com investidor atento a negociações para fim de guerra no Oriente Médio', 'description': 'O grande tema global ainda é a guerra dos EUA e Israel contra o Irã, que já avança pela quarta semana\nThe post Ibovespa sobe com investidor atento a negociações para fim de guerra no Oriente Médio appeared first on InfoMoney.', 'url': 'https://www.infomoney.com.br/mercados/ibovespa-sobe-com-investidor-atento-a-negociacoes-para-fim-de-guerra-no-oriente-medio/', 'urlToImage': 'https://www.infomoney.com.br/wp-content/uploads/2024/09/Captura-de-tela-2024-09-06-100616.png?quality=70', 'publishedAt': '2026-03-25T20:50:23Z', 'content': 'SÃO PAULO, 25 Mar (Reuters) O Ibovespa fechou em alta nesta quarta-feira, superando os 186 mil pontos no melhor momento, com noticiário sobre negociações buscando o fim da guerra no Oriente Médio nov… [+3603 chars]'}, {'source': {'id': 'info-money', 'name': 'InfoMoney'}, 'author': 'Estadão Conteúdo', 'title': 'Ibovespa vai aos 185 mil com ânimo no exterior por expectativa de pausa na guerra', 'description': 'O recuo do petróleo joga as ações da Petrobras para baixo, mas o recuo é moderado \nThe post Ibovespa vai aos 185 mil com ânimo no exterior por expectativa de pausa na guerra appeared first on InfoMoney.', 'url': 'https://www.infomoney.com.br/mercados/ibovespa-vai-aos-185-mil-com-animo-no-exterior-por-expectativa-de-pausa-na-guerra/', 'urlToImage': 'https://www.infomoney.com.br/wp-content/uploads/2024/10/Captura-de-tela-2024-10-03-175402.png?quality=70', 'publishedAt': '2026-03-25T14:32:27Z', 'content': 'A perspectiva de pausa na guerra no Oriente Médio empolga o Ibovespa na sessão desta quarta-feira, 24, de agenda esvaziada, que saltou cerca de 3.200 pontos entre a mínima e a máxima, na casa dos 185… [+2987 chars]'}, {'source': {'id': None, 'name': 'Abril.com.br'}, 'author': 'Carolina Ferraz', 'title': 'Ibovespa avança com alívio externo e alta generalizada de bancos', 'description': 'Sinais de trégua no Oriente Médio impulsionam mercados globais e favorecem ativos de risco', 'url': 'https://veja.abril.com.br/economia/ibovespa-avanca-com-alivio-externo-e-alta-generalizada-de-bancos/', 'urlToImage': 'https://veja.abril.com.br/wp-content/uploads/2025/11/GettyImages-1236444882-e1764968991535.jpg?quality=70&strip=info&resize=1080,565&crop=1', 'publishedAt': '2026-03-25T14:00:32Z', 'content': 'Pular para o conteúdo\r\nASSINE VEJA NEGÓCIOSIbovespa - Bolsa de São Paulo - B3\xa0(Patricia Monteiro/Bloomberg/Getty Images)\r\nContinua após publicidade\r\nO Ibovespa iniciou o pregão desta quarta-feira (25… [+1670 chars]'}, {'source': {'id': None, 'name': 'Abril.com.br'}, 'author': 'Leticia Yamakami', 'title': 'Ibovespa avança em dia de escalada de conflitos no Oriente Médio e ata do Copom', 'description': 'Principal índice da B3 foi sustentado por petroleiras e mineradoras, que subiram junto à alta do petróleo', 'url': 'https://veja.abril.com.br/economia/ibovespa-avanca-em-dia-de-escalada-de-conflitos-no-oriente-medio-e-ata-do-copom/', 'urlToImage': 'https://veja.abril.com.br/wp-content/uploads/2025/11/GettyImages-1236444882-e1764968991535.jpg?quality=70&strip=info&resize=1080,565&crop=1', 'publishedAt': '2026-03-24T21:17:16Z', 'content': 'Pular para o conteúdo\r\nASSINE VEJA NEGÓCIOSIbovespa - Bolsa de São Paulo - B3\xa0(Patricia Monteiro/Bloomberg/Getty Images)\r\nContinua após publicidade\r\nO Ibovespa teve leve valorização de 0,32% nesta te… [+2392 chars]'}]"
Banco Bradesco S.A.,BBDC4,Financial Services,Banks - Regional,"Banco Bradesco S.A., together with its subsidiaries, provides various banking products and services in Brazil and internationally. The company operates in two segments, Banking and Insurance. It engages in banking operations, including investment, national, international, and private banking, as well as investment fund management, consortium administration, middle market and corporate activities, and leasing. The company also provides retail banking products, such as demand, savings, and time deposits, as well as mutual funds, foreign exchange services, and various loans and advances comprising overdrafts, credit cards, and loans with repayments in installments; and fund management and treasury services, corporate finance, and hedge and finance operations, which include working capital financing. In addition, it provides insurance products, such as life, pension, health, and non-life, as well as related insurance operations, supplemental pension plans, and capitalization bonds. Further, the company offers cards, consortia, service packages and fees, auctions, debt renegotiation, and accounts; and various services comprising related transactions and inquiries, profile and help, purchases and benefits, and permissions. It serves individuals, corporates, and businesses. The company was incorporated in 1943 and is headquartered in Osasco, Brazil.",8.699531,0.13754,18.53,N/A,1.21,N/A,0.0,0.312,N/A,35751853,0.2481,22.12,11.82,"[{'source': {'id': None, 'name': 'Abril.com.br'}, 'author': 'Leticia Yamakami', 'title': 'Ibovespa sobe mais de 1% com possível cessar-fogo no Oriente Médio', 'description': 'Investidores operam com maior apetite ao risco após declarações da Casa Branca sobre fim de guerra e novas pesquisas eleitorais no Brasil', 'url': 'https://veja.abril.com.br/economia/ibovespa-sobe-mais-de-1-com-possivel-cessar-fogo-no-oriente-medio/', 'urlToImage': 'https://veja.abril.com.br/wp-content/uploads/2023/06/GettyImages-1229674447.jpg.jpg?quality=70&strip=info&resize=1080,565&crop=1', 'publishedAt': '2026-03-25T21:59:52Z', 'content': 'Pular para o conteúdo\r\nASSINE VEJA NEGÓCIOSO Ibovespa, principal índice da B3 (Bolsa de Valores de São Paulo).\xa0(Cris Faga/Getty Images)\r\nContinua após publicidade\r\nO Ibovespa teve valorização de 1,60… [+1965 chars]'}, {'source': {'id': 'info-money', 'name': 'InfoMoney'}, 'author': 'Lara Rizério', 'title': 'Bradesco (BBDC4) aprova pagamento de R$ 3 bilhões em JCP aos acionistas', 'description': 'Serão beneficiados os acionistas que tiverem ações no dia 6 de abril, sendo que as ações passam a ser negociados ""ex-direito"" a partir do dia 7\nThe post Bradesco (BBDC4) aprova pagamento de R$ 3 bilhões em JCP aos acionistas appeared first on InfoMoney.', 'url': 'https://www.infomoney.com.br/mercados/bradesco-bbdc4-aprova-pagamento-de-r-3-bilhoes-em-jcp-aos-acionistas/', 'urlToImage': 'https://www.infomoney.com.br/wp-content/uploads/2021/08/bradesco-BBDC3-BBDC4-e1738919720743.jpg?quality=70', 'publishedAt': '2026-03-25T21:43:35Z', 'content': '© 2000-2026 InfoMoney. Todos os direitos reservados.\r\n O InfoMoney preza a qualidade da informação e atesta a apuração de todo o conteúdo produzido por sua\r\n equipe,\r\n ressaltando, no entanto, que nã… [+1238 chars]'}, {'source': {'id': 'info-money', 'name': 'InfoMoney'}, 'author': 'Reuters', 'title': 'Ibovespa sobe com investidor atento a negociações para fim de guerra no Oriente Médio', 'description': 'O grande tema global ainda é a guerra dos EUA e Israel contra o Irã, que já avança pela quarta semana\nThe post Ibovespa sobe com investidor atento a negociações para fim de guerra no Oriente Médio appeared first on InfoMoney.', 'url': 'https://www.infomoney.com.br/mercados/ibovespa-sobe-com-investidor-atento-a-negociacoes-para-fim-de-guerra-no-oriente-medio/', 'urlToImage': 'https://www.infomoney.com.br/wp-content/uploads/2024/09/Captura-de-tela-2024-09-06-100616.png?quality=70', 'publishedAt': '2026-03-25T20:50:23Z', 'content': 'SÃO PAULO, 25 Mar (Reuters) O Ibovespa fechou em alta nesta quarta-feira, superando os 186 mil pontos no melhor momento, com noticiário sobre negociações buscando o fim da guerra no Oriente Médio nov… [+3603 chars]'}, {'source': {'id': None, 'name': 'Abril.com.br'}, 'author': 'Carolina Ferraz', 'title': 'Ibovespa avança com alívio externo e alta generalizada de bancos', 'description': 'Sinais de trégua no Oriente Médio impulsionam mercados globais e favorecem ativos de risco', 'url': 'https://veja.abril.com.br/economia/ibovespa-avanca-com-alivio-externo-e-alta-generalizada-de-bancos/', 'urlToImage': 'https://veja.abril.com.br/wp-content/uploads/2025/11/GettyImages-1236444882-e1764968991535.jpg?quality=70&strip=info&resize=1080,565&crop=1', 'publishedAt': '2026-03-25T14:00:32Z', 'content': 'Pular para o conteúdo\r\nASSINE VEJA NEGÓCIOSIbovespa - Bolsa de São Paulo - B3\xa0(Patricia Monteiro/Bloomberg/Getty Images)\r\nContinua após publicidade\r\nO Ibovespa iniciou o pregão desta quarta-feira (25… [+1670 chars]'}, {'source': {'id': None, 'name': 'Abril.com.br'}, 'author': 'Leticia Yamakami', 'title': 'Ibovespa avança em dia de escalada de conflitos no Oriente Médio e ata do Copom', 'description': 'Principal índice da B3 foi sustentado por petroleiras e mineradoras, que subiram junto à alta do petróleo', 'url': 'https://veja.abril.com.br/economia/ibovespa-avanca-em-dia-de-escalada-de-conflitos-no-oriente-medio-e-ata-do-copom/', 'urlToImage': 'https://veja.abril.com.br/wp-content/uploads/2025/11/GettyImages-1236444882-e1764968991535.jpg?quality=70&strip=info&resize=1080,565&crop=1', 'publishedAt': '2026-03-24T21:17:16Z', 'content': 'Pular para o conteúdo\r\nASSINE VEJA NEGÓCIOSIbovespa - Bolsa de São Paulo - B3\xa0(Patricia Monteiro/Bloomberg/Getty Images)\r\nContinua após publicidade\r\nO Ibovespa teve leve valorização de 0,32% nesta te… [+2392 chars]'}]"
OceanPact Serviços Marítimos S.A.,OPCT3,Industrials,Specialty Business Services,"OceanPact Serviços Marítimos S.A. provides services related to the study, protection, monitoring, and sustainable use of the sea, coastline, and marine resources in Brazil and internationally. It operates through two segments, Vessels and Services. The company provides environmental services, such as environmental protection, oceanographic surveys, environmental licensing and studies, operational safety, and environmental remediation; subsea services, including geophysics, geotechnics, inspection, repair, and maintenance services, as well as support services for construction and decommissioning activities; and logistics and engineering services comprising maritime logistics, offshore support base, and port and coastal engineering. It primarily serves the oil and gas sector, as well as other sectors, such as ports, shipping, mining, energy, and telecommunications. The company was incorporated in 2007 and is headquartered in Rio De Janeiro, Brazil.",16.792454,0.10507,8.9,206.071,N/A,-156960000.0,0.28676,1.089,2.594,528186,0.10663,9.79,4.94,"[{'source': {'id': 'info-money', 'name': 'InfoMoney'}, 'author': 'Felipe Moreira', 'title': 'Petrobras, GPA, Ultrapar, Rumo, Azul, Raízen e mais ações para acompanhar hoje', 'description': 'Confira os principais destaques no noticiário corporativo desta quinta-feira\nThe post Petrobras, GPA, Ultrapar, Rumo, Azul, Raízen e mais ações para acompanhar hoje appeared first on InfoMoney.', 'url': 'https://www.infomoney.com.br/mercados/petrobras-gpa-ultrapar-rumo-azul-raizen-e-mais-acoes-para-acompanhar-hoje/', 'urlToImage': 'https://www.infomoney.com.br/wp-content/uploads/2025/11/Captura-de-tela-2025-11-12-130824.png?quality=70', 'publishedAt': '2026-03-05T11:28:45Z', 'content': 'O radar corporativo desta quinta-feira (5) tem como destaque os resultados da Ultrapar (UGPA3), Rumo (RAIL3), Dexco (DXCO3), CBA (CBAV3), Oceanpact (OPCT3) e mais empresas. Após o fechamento dos merc… [+4336 chars]'}, {'source': {'id': 'info-money', 'name': 'InfoMoney'}, 'author': 'Felipe Moreira', 'title': 'Oceanpact (OPCT3): ação cai apesar de avaliação positiva sobre fusão com CBO', 'description': 'Transação cria uma empresa com frota combinada de 73 embarcações e carteira de contratos de R$ 13,6 bilhões\nThe post Oceanpact (OPCT3): ação cai apesar de avaliação positiva sobre fusão com CBO appeared first on InfoMoney.', 'url': 'https://www.infomoney.com.br/mercados/oceanpact-opct3-acao-cai-apesar-de-avaliacao-positiva-sobre-fusao-com-cbo/', 'urlToImage': 'https://www.infomoney.com.br/wp-content/uploads/2021/05/Oceanopact1.jpg?quality=70', 'publishedAt': '2026-03-02T17:06:53Z', 'content': 'A Oceanpact (OPCT3) anunciou, na última sexta-feira (27), a fusão com a CBO, operação que resultará na emissão de 274,5 milhões de novas ações e na incorporação da CBO, cujos acionistas passarão a de… [+2670 chars]'}, {'source': {'id': 'info-money', 'name': 'InfoMoney'}, 'author': 'Felipe Moreira', 'title': 'OceanPact, MBRF, Pague Menos, Petrobras e mais ações para acompanhar hoje', 'description': 'Confira os principais destaques do noticiário corporativo desta segunda-feira\nThe post OceanPact, MBRF, Pague Menos, Petrobras e mais ações para acompanhar hoje appeared first on InfoMoney.', 'url': 'https://www.infomoney.com.br/mercados/oceanpact-mbrf-pague-menos-petrobras-e-mais-acoes-para-acompanhar-hoje/', 'urlToImage': 'https://www.infomoney.com.br/wp-content/uploads/2025/09/Captura-de-tela-2025-09-17-115206-e1770668490299.png?quality=70', 'publishedAt': '2026-03-02T10:24:34Z', 'content': 'O radar corporativo desta segunda-feira (2) traz a combinação de negócios das empresas de serviços marítimos CBO e Oceanpact (OPCT3). Além disso, a Petrobras (PETR4) divulgará resultados na quinta-fe… [+2134 chars]'}]"
Banco do Estado do Rio Grande do Sul S.A.,BRSR6,Financial Services,Banks - Regional,"Banco do Estado do Rio Grande do Sul S.A., a multiple-service bank, provides a range of banking products and services primarily in Brazil. The company engages in the retail banking, lending, financing and investment, mortgage loan, development, lease portfolio, and foreign exchange activities. It also provides securities brokerage, consortium groups, payment industry solutions, insurance, and pension plan and saving bonds products. Banco do Estado do Rio Grande do Sul S.A. was incorporated in 1928 and is headquartered in Porto Alegre, Brazil.",4.0023866,0.1567,16.78,N/A,6.24,N/A,0.0,0.345,N/A,1930193,0.44894,19.2,10.18,"[{'source': {'id': 'info-money', 'name': 'InfoMoney'}, 'author': 'Felipe Moreira', 'title': 'Raízen, PRIO, Cury, Allos, CSN, Pague Menos, Ultra e mais ações para acompanhar hoje', 'description': 'Confira os principais destaques do noticiário corporativo desta quarta-feira\nThe post Raízen, PRIO, Cury, Allos, CSN, Pague Menos, Ultra e mais ações para acompanhar hoje appeared first on InfoMoney.', 'url': 'https://www.infomoney.com.br/mercados/raizen-prio-cury-allos-csn-pague-menos-ultra-e-mais-acoes-para-acompanhar-hoje/', 'urlToImage': 'https://www.infomoney.com.br/wp-content/uploads/2025/09/Captura-de-tela-2025-09-17-115206-e1770668490299.png?quality=70', 'publishedAt': '2026-03-11T11:44:32Z', 'content': 'O radar corporativo tem como destaque os resultados de PRIO (PRIO3), Cury (CURY3) e Allos (ALOS3). Após o fechamento dos mercados, CSN (CSNA3), Vibra (VBBR3), Casas Bahia (BHIA3), Cogna (COGN3) e YDU… [+4752 chars]'}, {'source': {'id': 'info-money', 'name': 'InfoMoney'}, 'author': 'Felipe Moreira', 'title': 'Banrisul (BRSR6) anuncia R$ 90 milhões em proventos; veja quem tem direito', 'description': 'O pagamento ocorrerá no dia 26 de março\nThe post Banrisul (BRSR6) anuncia R$ 90 milhões em proventos; veja quem tem direito appeared first on InfoMoney.', 'url': 'https://www.infomoney.com.br/mercados/banrisul-brsr6-anuncia-r-90-milhoes-em-proventos-veja-quem-tem-direito/', 'urlToImage': 'https://www.infomoney.com.br/wp-content/uploads/2024/12/graph-163509_1920.jpg?quality=70', 'publishedAt': '2026-03-11T11:33:31Z', 'content': '© 2000-2026 InfoMoney. Todos os direitos reservados.\r\n O InfoMoney preza a qualidade da informação e atesta a apuração de todo o conteúdo produzido por sua\r\n equipe,\r\n ressaltando, no entanto, que nã… [+1238 chars]'}]"
Prio S.A.,PRIO3,Energy,Oil & Gas E&P,"Prio S.A., together with its subsidiaries, engages in the exploration, development, and production of oil and natural gas properties in Brazil and internationally. The company holds 100% interest in the Polvo Field covering an area of approximately 134 square kilometers located in the southern portion of the Campos Basin, Rio de Janeiro; and the Frade Field that consists of approximately 154 square kilometers located in the northern region of the Campos Basin, Rio de Janeiro. It also holds interest in the Albacora leste Field and the Wahoo and Itaipu Field located in the Camumu Basin, State of Bahia. In addition, the company imports, exports, refines, sells, and distributes oil, natural gas, fuels, and oil by-products; and engages in the generation, sale, and distribution of electric power, as well as holds interests in other companies. The company was formerly known as Petro Rio S.A. and changed its name to Prio S.A. in May 2023. Prio S.A. was incorporated in 2009 and is headquartered in Rio de Janeiro, Brazil.",25.581228,0.08708999,70.86,110.312,N/A,-12695716864.0,0.51533,0.481,1.819,14291043,0.098859996,71.55,32.68,"[{'source': {'id': 'info-money', 'name': 'InfoMoney'}, 'author': 'Estadão Conteúdo', 'title': 'Ibovespa vai aos 185 mil com ânimo no exterior por expectativa de pausa na guerra', 'description': 'O recuo do petróleo joga as ações da Petrobras para baixo, mas o recuo é moderado \nThe post Ibovespa vai aos 185 mil com ânimo no exterior por expectativa de pausa na guerra appeared first on InfoMoney.', 'url': 'https://www.infomoney.com.br/mercados/ibovespa-vai-aos-185-mil-com-animo-no-exterior-por-expectativa-de-pausa-na-guerra/', 'urlToImage': 'https://www.infomoney.com.br/wp-content/uploads/2024/10/Captura-de-tela-2024-10-03-175402.png?quality=70', 'publishedAt': '2026-03-25T14:32:27Z', 'content': 'A perspectiva de pausa na guerra no Oriente Médio empolga o Ibovespa na sessão desta quarta-feira, 24, de agenda esvaziada, que saltou cerca de 3.200 pontos entre a mínima e a máxima, na casa dos 185… [+2987 chars]'}, {'source': {'id': 'info-money', 'name': 'InfoMoney'}, 'author': 'Reuters', 'title': 'Ibovespa fecha em alta com Petrobras em meio a sinais contraditórios no Oriente Médio', 'description': 'Índice de referência do mercado acionário brasileiro, o Ibovespa (IBOV) subiu 0,32%, a 182.509,14 pontos\nThe post Ibovespa fecha em alta com Petrobras em meio a sinais contraditórios no Oriente Médio appeared first on InfoMoney.', 'url': 'https://www.infomoney.com.br/mercados/ibovespa-fecha-em-alta-com-petrobras-em-meio-a-sinais-contraditorios-no-oriente-medio/', 'urlToImage': 'https://www.infomoney.com.br/wp-content/uploads/2024/08/Captura-de-tela-2024-08-15-092426.png?quality=70', 'publishedAt': '2026-03-24T20:45:25Z', 'content': 'SÃO PAULO, 24 Mar (Reuters) O Ibovespa fechou em alta nesta terça-feira, sustentada principalmente pelo avanço da Petrobras (PETR4) na esteira do movimento do preço do petróleo no exterior, enquanto … [+5544 chars]'}, {'source': {'id': 'info-money', 'name': 'InfoMoney'}, 'author': 'camillebocanegra', 'title': 'Ações da Petrobras, da PRIO e de outras petroleiras sobem com nova alta do petróleo', 'description': 'Preços de contratos do petróleo voltaram a subir nesta terça-feira, com brent novamente ultrapassando os US$ 102\nThe post Ações da Petrobras, da PRIO e de outras petroleiras sobem com nova alta do petróleo appeared first on InfoMoney.', 'url': 'https://www.infomoney.com.br/mercados/acoes-da-petrobras-da-prio-e-de-outras-petroleiras-sobem-com-nova-alta-do-petroleo/', 'urlToImage': 'https://www.infomoney.com.br/wp-content/uploads/2025/04/Petroleo.jpg?quality=70', 'publishedAt': '2026-03-24T15:49:15Z', 'content': 'Após petroleiras chegarem a cair durante a sessão da segunda-feira (23), papéis de petroleiras como Petrobras (PETR3; PETR4), PRIO (PRIO3) e PetroReconcavo (RECV3) avançam no pregão desta terça (24).… [+1527 chars]'}, {'source': {'id': 'info-money', 'name': 'InfoMoney'}, 'author': 'Lara Rizério', 'title': 'Ibovespa “orbita” nos 182 mil pontos com Petrobras apesar de receio com Oriente Médio', 'description': 'Depois de desabar na véspera, o preço do petróleo voltou a subir no exterior\nThe post Ibovespa “orbita” nos 182 mil pontos com Petrobras apesar de receio com Oriente Médio appeared first on InfoMoney.', 'url': 'https://www.infomoney.com.br/mercados/ibovespa-orbita-nos-182-mil-pontos-com-petrobras-apesar-de-receio-com-oriente-medio/', 'urlToImage': 'https://www.infomoney.com.br/wp-content/uploads/2025/03/Mulher_B3.jpg?quality=70', 'publishedAt': '2026-03-24T15:41:29Z', 'content': 'SÃO PAULO, 24 Mar (Reuters) O Ibovespa titubeava nesta terça-feira, após fortes ganhos na véspera, em meio a um ambiente ainda volátil envolvendo o conflito no Oriente Médio, com novos ataques do Irã… [+3863 chars]'}, {'source': {'id': 'info-money', 'name': 'InfoMoney'}, 'author': 'Rodrigo Paz', 'title': 'Ibovespa ganha força após correção; alta pode levar a nova máxima?', 'description': 'Mercado avalia se rali recente é repique ou retomada da tendência.\nThe post Ibovespa ganha força após correção; alta pode levar a nova máxima? appeared first on InfoMoney.', 'url': 'https://www.infomoney.com.br/mercados/ibovespa-ganha-forca-apos-correcao-alta-pode-levar-a-nova-maxima/', 'urlToImage': 'https://www.infomoney.com.br/wp-content/uploads/2025/11/ChatGPT-Image-4-de-nov.-de-2025-20_20_10.png?fit=1536%2C1024&quality=70&strip=all', 'publishedAt': '2026-03-24T09:09:00Z', 'content': 'O Ibovespa (IBOV) voltou a ganhar força na última sessão, com alta expressiva de 3,24%, encerrando aos 181.931 pontos e retomando o patamar dos 180 mil pontos. O movimento foi amplamente disseminado,… [+3906 chars]'}]"
