nome,ticker,setor,segAtuacao,descricao,preco_atual,variacao_dia,market_cap,P/L,ROE,debtToEquity,dividendYield,freeCashflow,ebitdaMargins,Beta,Liqui Corrente,Vol Med Diário,Margem Operacional,Máxima 52 Semanas,Mínima 52 Semanas,resumo_negocio,analise_fundamentos,noticias_json,sentimentos_json,perguntas_json,erro
Sendas Distribuidora S.A.,ASAI3,Consumer Defensive,Grocery Stores,"Sendas Distribuidora S.A. engages in the retail and wholesale sale of food products, bazaar items, and other products in Brazil. The company offers grocery, food, perishable, beverage, wrapping, and hygiene products; and parking, air-conditioned, well-lit environments, and butcher services. It serves restaurants, pizzerias, snack bars, schools, small businesses, religious institutions, hospitals, hotels, grocery stores, neighborhood supermarkets, and individuals. The company sells its products through brick-and-mortar stores, as well as telesales. The company was founded in 1974 and is headquartered in Rio De Janeiro, Brazil.",8.69,5.8465233,11659740160,12.779411,0.09196,482.121,1.37,435875008.0,0.07553,0.43,1.058,16210153,0.0577,12.04,6.91,"A Sendas Distribuidora S.A. atua no varejo e atacado de produtos alimentícios e outros itens no Brasil, oferecendo uma variedade de produtos e serviços em ambientes bem equipados. O modelo de negócio da empresa busca gerar valor por meio da oferta de produtos essenciais e da criação de uma experiência de compra atraente para os clientes. No entanto, a geração de valor pode ser impactada por fatores como a inflação de alimentos e a pressão no consumo.","Os indicadores financeiros da Sendas Distribuidora S.A. apresentam alguns desafios. O ROE de 0,09% é extremamente baixo, indicando uma baixa rentabilidade dos acionistas. Além disso, a margem operacional e a margem EBITDA são muito baixas, o que pode ser um sinal de pressão nos preços e custos. No entanto, o fluxo de caixa livre (FCF) é positivo, o que é um ponto positivo. O preço da ação está em 35% do range de 52 semanas, o que pode ser considerado um nível razoável. O beta de 0,43 indica uma baixa volatilidade em relação ao mercado.","{""positivas"": [], ""negativas"": [""Inflação de alimentos em alta pode impactar negativamente a empresa"", ""Varejo tem 4º tri desafiador com pressão no consumo e balanços fracos""], ""neutras"": [""Nvidia e OpenAI disparam com novas projeções de receita"", ""8 ações sobem mais de 10% e 8 caem mais de 10%: os destaques do Ibovespa em fevereiro""]}","{""geral"": ""neutro"", ""fundamentos"": ""negativo"", ""noticias"": ""negativo""}","[""Qual é o impacto da inflação de alimentos na margem de lucro da empresa?"", ""Como a empresa planeja lidar com a pressão no consumo e os balanços fracos no varejo?"", ""Quais são as principais estratégias da empresa para melhorar a rentabilidade e o fluxo de caixa?""]",
Petroreconcavo S.A.,RECV3,Energy,Oil & Gas E&P,"Petroreconcavo S.A. engages in the exploration and production of oil and natural gas in Brazil. The company was founded in 1999 and is headquartered in Mata de São João, Brazil.",13.58,2.105261,3978640128,6.2293577,0.13571,53.307,15.13,-995250624.0,0.47425,0.078,2.158,4516963,0.20041999,16.96,10.07,"A Petroreconcavo S.A. é uma empresa de exploração e produção de petróleo e gás natural no Brasil, com foco em gerar valor através da exploração e produção de recursos naturais. O modelo de negócio da empresa depende fortemente do preço do petróleo e da capacidade de gerar caixa de forma previsível. No entanto, a empresa enfrenta desafios devido à volatilidade do mercado de petróleo e à concorrência intensa no setor.","Os indicadores financeiros da Petroreconcavo S.A. apresentam alguns sinais de alerta. O ROE de 0,14% é extremamente baixo, indicando que a empresa não está gerando valor para os acionistas. Além disso, o FCF negativo de R$ -995,3M sugere que a empresa está enfrentando dificuldades para gerar caixa. No entanto, a margem operacional de 0,20% e a liquidez corrente de 2,16x indicam que a empresa tem algum espaço para manobrar. O preço da ação está atualmente em 51% do range de 52 semanas, o que pode ser um sinal de que o mercado está descontando os riscos da empresa.","{""positivas"": [""Ações da Petrobras, da PRIO e de outras petroleiras sobem com nova alta do petróleo""], ""negativas"": [""Ibovespa cai 2,25% e vai para mínima em 2 meses sem sinais de arrefecimento de guerra""], ""neutras"": [""Ibovespa fecha em alta com Petrobras em meio a sinais contraditórios no Oriente Médio"", ""Ibovespa “orbita” nos 182 mil pontos com Petrobras apesar de receio com Oriente Médio"", ""Ibovespa reage e fecha em alta de 0,35%, com Hapvida em destaque""]}","{""geral"": ""neutro""}","[""Qual é o plano da empresa para melhorar o ROE e gerar valor para os acionistas?"", ""Como a empresa pretende lidar com a volatilidade do mercado de petróleo e a concorrência intensa no setor?"", ""Quais são as perspectivas de crescimento da empresa nos próximos 3 a 5 anos?""]",
Movida Participações S.A.,MOVI3,Industrials,Rental & Leasing Services,"Movida Participações S.A., through its subsidiaries, provides car rental services in Brazil. It operates in two segments, Rent-a-Car, and Fleet Management and Outsourcing (GTF). The company offers light vehicle rental services; fleet management and outsourcing services; fleet sizing study, including acquisition, customization, and standardization of the customer's fleet; management of maintenance, provision of temporary vehicles, spare car, documentation management, and demobilization; and corrective and preventive maintenance, insurance, tire replacement, and replacement vehicles for maintenance periods. It also sells pre-owned cars. The company was formerly known as H.L.C.S.P.E Empreendimentos e Participações S.A. and changed its name to Movida Participações S.A. in December 2014. The company was founded in 2006 and is based in São Paulo, Brazil. Movida Participações S.A. operates as a subsidiary of Simpar S.A.",12.19,-2.8685308,4190660096,13.395603,0.116610005,763.605,7.5,3983031040.0,0.36856997,0.351,0.556,4892409,0.2325,14.97,4.64,"A Movida Participações S.A. atua no setor de aluguel de veículos e gestão de frota, oferecendo serviços de aluguel de veículos leves e soluções de gestão de frota para empresas. O modelo de negócio da empresa busca gerar valor por meio da oferta de serviços personalizados e eficientes, visando atender às necessidades de seus clientes. A geração de caixa é influenciada pela demanda por serviços de aluguel de veículos e gestão de frota, que pode variar de acordo com as condições econômicas e a concorrência no mercado.","Os indicadores financeiros da Movida apresentam alguns pontos de atenção. O ROE de 0,12% é baixo, indicando que a empresa não está gerando retornos significativos sobre o patrimônio líquido. Além disso, a margem operacional de 0,23% e a margem EBITDA de 0,37% são baixas, o que pode ser um sinal de pressão sobre os preços ou custos elevados. No entanto, o fluxo de caixa livre (FCF) de R$ 3,98 bilhões é positivo, o que é um ponto positivo. O preço da ação está atualmente em 73% do range de 52 semanas, o que pode indicar que a ação está sobrevalorizada. A liquidez corrente de 0,56x é baixa, o que pode ser um sinal de pressão de curto prazo sobre a empresa.","{""positivas"": [""Movida (MOVI3) lucra R$ 102,3 milhões no 4º tri, alta anual de 64,5%""], ""negativas"": [""Movida (MOVI3) encerra semestre com números fortes mas ação recua mais de 2%""], ""neutras"": [""Movida, Vibra, Suzano, Rede D’Or e mais ações para acompanhar hoje"", ""Bolsa brasileira: dos 94 IPOs feitos desde 2014, só 17 apresentam ganhos"", ""Simpar: No médio e longo prazo, não tem conta pra fazer, diz CFO sobre capitalização""]}","{""geral"": ""neutro""}","[""Qual é a estratégia da empresa para melhorar a margem operacional e EBITDA?"", ""Como a empresa planeja lidar com a pressão de curto prazo sobre a liquidez?"", ""Quais são os principais fatores que influenciam a demanda por serviços de aluguel de veículos e gestão de frota no Brasil?""]",
Braskem S.A.,BRKM5,Basic Materials,Chemicals,"Braskem S.A., together with its subsidiaries, engages in the manufacture, sale, import, and export of chemicals, petrochemicals, and fuels in Brazil. It produces and sells polyethylene (PE), polypropylene, tertiary-butyl ethyl ether, gasoline, benzene, toluene, xylene, ethylene, propylene, polyvinyl chloride, caustic soda, butadiene, cumene, naphtha, solvents, and condensate; thermoplastic resins; and basic petrochemicals. The company also supplies electricity and other inputs to second-generation producers; and sale of utilities such as steam, water, compressed air and industrial gases, as well as provides industrial services and natural gas. It also operates in the United States, Mexico, Switzerland, Argentina, Germany, Japan, the Netherlands, Singapore, Chile, Spain, Peru, Italy, Luxembourg, China, and internationally. The company was formerly known as Copene Petroquímica do Nordeste S.A. and changed its name to Braskem S.A. in 2002. Braskem S.A. was founded in 1972 and is headquartered in São Paulo, Brazil. Braskem S.A. is a subsidiary of NSP Investimentos S.A.",9.05,-10.837434,7212563968,,,,,-7746124800.0,-0.00481,0.851,1.175,4849596,-0.096540004,13.78,6.11,"A Braskem S.A. é uma empresa de materiais básicos que gera valor através da produção e venda de produtos químicos, petroquímicos e combustíveis. Seu modelo de negócio depende fortemente do ciclo econômico e da demanda por esses produtos. A empresa enfrenta desafios para manter margens de lucro devido à competição e flutuações nos preços dos commodities.","Os indicadores financeiros da Braskem S.A. apontam para uma saúde financeira fragilizada, com um fluxo de caixa livre (FCF) negativo de R$ -7.75B, margem EBITDA nula e margem operacional negativa de -0.10%. A liquidez corrente de 1.18x indica uma capacidade razoável de atender a obrigações de curto prazo, mas o contexto de perda líquida de R$ 10,2 bilhões no 4º trimestre de 2025 e a queda de 9% nas ações após o anúncio dos resultados sugere um momento desafiador para a empresa.","{""positivas"": [], ""negativas"": [""Braskem (BRKM5): ações desabam 9% após 4T frustrante com prejuízo de mais de R$ 10 bi"", ""Braskem (BRKM5) tem prejuízo líquido de R$ 10,2 bilhões no 4º tri de 2025""], ""neutras"": [""Braskem (BRKM5) vê alta de spreads com continuação de guerra no Oriente Médio"", ""Ibovespa Futuro recua, seguindo exterior, de olho em negociações de conflito no Irã"", ""Petrobras, União Pet, Braskem, Gafisa e mais ações para acompanhar hoje""]}","{""geral"": ""negativo"", ""justificativa"": ""Devido aos resultados financeiros desfavoráveis e à reação negativa do mercado.""}","[""Qual é o plano de ação da gestão para reverter as perdas e melhorar a saúde financeira da empresa?"", ""Como a empresa pretende lidar com a volatilidade dos preços dos commodities e manter margens de lucro?"", ""Quais são as perspectivas de crescimento de longo prazo para a Braskem S.A. considerando o atual cenário econômico e a competição no setor?""]",
Hidrovias do Brasil S.A.,HBSA3,Industrials,Integrated Freight & Logistics,"Hidrovias do Brasil S.A., together with its subsidiaries, provides integrated logistics solutions for waterways in Brazil and internationally. The company is involved in transportation of goods; construction and operation of ports, cargo terminals, shipyards, workshops, and warehouses; river and sea navigation, coastal navigation, and storage of goods; and provision of logistics services and other related activities. It also offers maritime transportation, port terminals, and warehousing services. In addition, the company provides cargo storage and lifting, river transport, handling and storage, specialized cargo terminal, leases navigation, and shipping assets, as well as offers financial transactions agency. It operates four port terminals with 16.7 million tons total loading capacity; and current waterway fleet, which has 484 cargo barges, 24 main tugboats, 7 auxiliary tugboats. Hidrovias do Brasil S.A. was incorporated in 2010 and is headquartered in São Paulo, Brazil.",3.95,-3.1862717,5373511168,79.0,0.03765,172.435,,-183040496.0,0.3793,0.697,2.972,2214508,-0.059660003,4.39,2.06,"A Hidrovias do Brasil S.A. oferece soluções logísticas integradas para hidrovias no Brasil e internacionalmente, gerando valor por meio da transportação de mercadorias, construção e operação de portos, terminais de carga, estaleiros, oficinas e armazéns. O modelo de negócio da empresa busca aproveitar a demanda por serviços de logística eficientes e seguros. No entanto, a geração de valor está diretamente relacionada à capacidade da empresa de manter margens operacionais saudáveis e gerar fluxo de caixa positivo.","Os indicadores financeiros da Hidrovias do Brasil S.A. apresentam desafios significativos. O ROE de 0,04% é extremamente baixo, indicando uma geração de valor para os acionistas muito aquém do esperado. Além disso, o FCF negativo de R$ -183,0M e a margem operacional negativa de -0,06% sugerem dificuldades na gestão de caixa e na manutenção de margens saudáveis. O preço atual, representando 81% do range de 52 semanas, pode ser considerado alto diante desses fundamentos. A liquidez corrente de 2,97x é um dos poucos pontos positivos, indicando capacidade de pagamento de curto prazo.","{""positivas"": [""Ultrapar tem resultados sólidos com Ipiranga, Hidrovias e Ultragaz e ações reagem""], ""negativas"": [""Hidrovias do Brasil tem prejuízo de R$ 361 mi no 4º tri, baixa anual de 11%""], ""neutras"": [""Ultra (UGPA3) lucra R$ 256 mi no 4º tri; estima investimento de R$ 2,6 bi em 2026""]}","{""geral"": ""neutro"", ""preco"": ""alto"", ""fundamentos"": ""desafiadores""}","[""Qual é a estratégia da empresa para melhorar a margem operacional e gerar fluxo de caixa positivo?"", ""Como a empresa planeja lidar com a baixa anual de 11% e o prejuízo no 4º trimestre?"", ""Quais são as perspectivas de investimento e crescimento para a Hidrovias do Brasil S.A. nos próximos anos?""]",
Itaú Unibanco Holding S.A.,ITUB4,Financial Services,Banks - Regional,"Itaú Unibanco Holding S.A. provides various financial products and services to personal and corporate customers in Brazil and internationally. It operates through three segments: Retail Business, Wholesale Business and Activities with the Market + Corporation. The company offers current accounts; funds management; payments and collections; loans; credit and debit cards; investment and commercial banking services; real estate lending and financing services; economic, financial and brokerage advisory; and leasing and foreign exchange services. The company also provides non-life insurance products covering loss, damage, or liability for objects or people, as well as life insurance products covering death and personal accidents. It serves retail customers, account and non-account holders, individuals and legal entities, high income clients, microenterprises, and small companies, as well as middle-market companies and high net worth institutional clients. The company was formerly known as Itaú Unibanco Banco Múltiplo S.A. and changed its name to Itaú Unibanco Holding S.A. in April 2009. The company was incorporated in 1924 and is headquartered in São Paulo, Brazil. Itaú Unibanco Holding S.A. is a subsidiary of IUPAR - Itaú Unibanco Participações S.A.",41.45,-1.1683307,456831598592,10.336658,0.21014,,1.32,,0.0,0.215,,29765394,0.37305,49.67,29.650484,"O Itaú Unibanco Holding S.A. oferece uma ampla gama de produtos e serviços financeiros para clientes pessoais e corporativos no Brasil e internacionalmente, operando através de três segmentos: Retail Business, Wholesale Business e Activities with the Market + Corporation. A geração de valor da empresa está relacionada à sua capacidade de oferecer serviços financeiros diversificados e atrair depósitos, além de gerar receita através de taxas e juros. A empresa busca manter uma posição competitiva no mercado financeiro brasileiro e internacional.","Os indicadores financeiros do Itaú Unibanco Holding S.A. mostram um ROE de 0,21%, o que é relativamente baixo e pode indicar uma geração de valor abaixo do esperado. O P/L de 10,34x é moderado, considerando o setor financeiro. A margem operacional de 0,37% é baixa, o que pode ser um sinal de pressão nos preços ou custos elevados. O beta de 0,21 indica uma baixa volatilidade em relação ao mercado, o que pode ser um fator positivo. No entanto, a falta de dados sobre a dívida e o fluxo de caixa livre limita a análise da saúde financeira da empresa.","{""positivas"": [""Ibovespa sobe mais de 1% com possível cessar-fogo no Oriente Médio""], ""negativas"": [""Ibovespa encerra fevereiro com desvalorização de mais de 4%"", ""Ibovespa recua mais de 1% com vai-e-vem da guerra no Oriente Médio e prévia da inflação"", ""Ibovespa fecha em queda de 1,45% com dúvidas sobre desfecho no Oriente Médio""], ""neutras"": [""Ibovespa sobe com investidor atento a negociações para fim de guerra no Oriente Médio""]}","{""geral"": ""neutro"", ""financeiro"": ""cauteloso""}","[""Qual é o impacto da guerra no Oriente Médio na estratégia de investimento da empresa?"", ""Como a empresa planeja melhorar sua margem operacional e ROE?"", ""Quais são os principais riscos e oportunidades para o Itaú Unibanco Holding S.A. nos próximos 3 a 5 anos?""]",
Banco Bradesco S.A.,BBDC4,Financial Services,Banks - Regional,"Banco Bradesco S.A., together with its subsidiaries, provides various banking products and services in Brazil and internationally. The company operates in two segments, Banking and Insurance. It engages in banking operations, including investment, national, international, and private banking, as well as investment fund management, consortium administration, middle market and corporate activities, and leasing. The company also provides retail banking products, such as demand, savings, and time deposits, as well as mutual funds, foreign exchange services, and various loans and advances comprising overdrafts, credit cards, and loans with repayments in installments; and fund management and treasury services, corporate finance, and hedge and finance operations, which include working capital financing. In addition, it provides insurance products, such as life, pension, health, and non-life, as well as related insurance operations, supplemental pension plans, and capitalization bonds. Further, the company offers cards, consortia, service packages and fees, auctions, debt renegotiation, and accounts; and various services comprising related transactions and inquiries, profile and help, purchases and benefits, and permissions. It serves individuals, corporates, and businesses. The company was incorporated in 1943 and is headquartered in Osasco, Brazil.",18.52,-1.5940448,195769597952,8.694836,0.13754,,1.23,,0.0,0.312,,35751853,0.2481,22.12,11.82,"O Banco Bradesco S.A. opera em dois segmentos principais, Banking e Insurance, oferecendo uma ampla gama de produtos e serviços bancários em Brasil e internacionalmente. A geração de valor é impulsionada pela diversificação de suas operações, incluindo investimentos, bancos nacionais e internacionais, bem como serviços de private banking. No entanto, a baixa margem de EBITDA e o retorno sobre o patrimônio líquido (ROE) de 0,14% indicam desafios na geração de lucro e eficiência operacional.","A combinação de um baixo ROE e uma margem operacional de 0,25% sugere que o Banco Bradesco enfrenta desafios significativos em termos de eficiência e geração de lucro. O preço atual de 8,69 vezes o lucro por ação, considerando o baixo crescimento e a incerteza econômica, pode não refletir um valor justo. Além disso, o beta de 0,31 indica uma volatilidade relativamente baixa, o que pode ser atraente em um cenário de incerteza, mas a baixa rentabilidade e a falta de crescimento são preocupações significativas.","{""positivas"": [""Bradesco (BBDC4) aprova pagamento de R$ 3 bilhões em JCP aos acionistas""], ""negativas"": [""Ibovespa encerra fevereiro com desvalorização de mais de 4%"", ""Ibovespa recua mais de 1% com vai-e-vem da guerra no Oriente Médio e prévia da inflação"", ""Ibovespa fecha em queda de 1,45% com dúvidas sobre desfecho no Oriente Médio""], ""neutras"": [""Ibovespa sobe mais de 1% com possível cessar-fogo no Oriente Médio""]}","{""geral"": ""neutro"", ""economia"": ""negativo"", ""setor"": ""neutro""}","[""Qual é o plano de ação do Banco Bradesco para melhorar sua eficiência operacional e aumentar o ROE?"", ""Como o banco pretende lidar com a incerteza econômica e os desafios regulatórios no setor bancário?"", ""Quais são as principais iniciativas do Banco Bradesco para impulsionar o crescimento e a rentabilidade nos próximos anos?""]",
OceanPact Serviços Marítimos S.A.,OPCT3,Industrials,Specialty Business Services,"OceanPact Serviços Marítimos S.A. provides services related to the study, protection, monitoring, and sustainable use of the sea, coastline, and marine resources in Brazil and internationally. It operates through two segments, Vessels and Services. The company provides environmental services, such as environmental protection, oceanographic surveys, environmental licensing and studies, operational safety, and environmental remediation; subsea services, including geophysics, geotechnics, inspection, repair, and maintenance services, as well as support services for construction and decommissioning activities; and logistics and engineering services comprising maritime logistics, offshore support base, and port and coastal engineering. It primarily serves the oil and gas sector, as well as other sectors, such as ports, shipping, mining, energy, and telecommunications. The company was incorporated in 2007 and is headquartered in Rio De Janeiro, Brazil.",8.82,-2.108774,1758297856,16.64151,0.10507,206.071,,-156960000.0,0.28676,1.089,2.594,528186,0.10663,9.79,4.94,"A OceanPact Serviços Marítimos S.A. oferece serviços relacionados ao estudo, proteção, monitoramento e uso sustentável do mar, costa e recursos marinhos no Brasil e internacionalmente. A empresa opera em dois segmentos, Vessels e Services, e fornece serviços ambientais. No entanto, o modelo de negócio parece enfrentar desafios, considerando o baixo ROE e o fluxo de caixa operacional negativo.","Os indicadores financeiros da OceanPact apresentam sinais de alerta. O ROE de 0,11% é extremamente baixo, indicando uma geração de valor muito fraca para os acionistas. Além disso, o fluxo de caixa operacional negativo de R$ -157,0M e a margem EBITDA de 0,29% são preocupantes. Por outro lado, a liquidez corrente de 2,59x sugere que a empresa tem capacidade de honrar seus compromissos de curto prazo. O preço da ação está próximo do topo do range de 52 semanas, o que pode indicar um momento desafiador para entrada.","{""positivas"": [], ""negativas"": [""Oceanpact (OPCT3): ação cai apesar de avaliação positiva sobre fusão com CBO""], ""neutras"": [""Petrobras, GPA, Ultrapar, Rumo, Azul, Raízen e mais ações para acompanhar hoje"", ""OceanPact, MBRF, Pague Menos, Petrobras e mais ações para acompanhar hoje""]}","{""acao"": ""neutro"", ""setor"": ""neutro""}","[""Qual é o plano da empresa para melhorar o ROE e gerar fluxo de caixa operacional positivo?"", ""Como a fusão com a CBO pode impactar o desempenho financeiro da OceanPact?"", ""Quais são os principais riscos e desafios que a empresa enfrenta no mercado de serviços marítimos?""]",
